{"ambiguitySets":[{"id":"isabah-ambiguity-asad-genealogy-v1","memberClaimIds":["isabah-claim-asad-nephew-of-khadijah-v1","isabah-claim-asad-son-of-nawfal-v1","isabah-claim-nawfal-brother-of-khadijah-v1"],"presentationMode":"qualified_ambiguity_context","rationaleCodes":["competing-genealogical-attributions"],"resolutionStatus":"unresolved","sourceRecordIds":["openiti-5835c183-unit-000097"]},{"id":"isabah-ambiguity-ibrahim-maternal-attribution-v1","memberClaimIds":["isabah-claim-khadijah-mother-of-ibrahim-v1","isabah-claim-mariya-mother-of-ibrahim-v1"],"presentationMode":"parallel_attributed_reports","rationaleCodes":["competing-maternal-attributions","source-author-rejection"],"resolutionStatus":"unresolved","sourceRecordIds":["openiti-5835c183-unit-000399"]},{"id":"isabah-ambiguity-bahira-journey-context-v1","memberClaimIds":["isabah-claim-abu-talib-commercial-journey-v1","isabah-claim-khadijah-commercial-journey-v1"],"presentationMode":"parallel_attributed_reports","rationaleCodes":["competing-journey-contexts","identity-and-religious-affiliation-ambiguity","chronology-uncertainty"],"resolutionStatus":"unresolved","sourceRecordIds":["openiti-5835c183-unit-000795"]}],"canonicalPromotion":"blocked","claims":{"attested":[{"assertionClass":"attested","claimType":"relationship","correctionOfClaimId":null,"evidentiaryStrength":"source_supported","factualAmbiguityCodes":[],"id":"isabah-claim-al-aswad-nephew-of-khadijah-v1","objectId":"isabah-relationship-al-aswad-nephew-of-khadijah-v1","predicate":"nephew_of","rationaleCodes":["machine-passed-no-unresolved-findings"],"sourceCriticalStatus":"unqualified","sourceRecordIds":["openiti-5835c183-unit-000171"],"sourceReportExistence":"attested_in_source","status":"active","storyAttributionRequired":false,"storyUseTier":"factual_spine","subjectId":"isabah-person-al-aswad-ibn-nawfal-v1","supersededByClaimId":null,"supersedesClaimIds":[],"transmissionStrength":"source_supported"},{"assertionClass":"attested","claimType":"event_participation","correctionOfClaimId":null,"evidentiaryStrength":"source_supported","factualAmbiguityCodes":[],"id":"isabah-claim-al-aswad-migration-one-v1","objectId":"isabah-event-al-aswad-migration-one-v1","predicate":"participated_in","rationaleCodes":["context-not-subject-biography"],"sourceCriticalStatus":"unqualified","sourceRecordIds":["openiti-5835c183-unit-000171"],"sourceReportExistence":"attested_in_source","status":"active","storyAttributionRequired":false,"storyUseTier":"qualified_context","subjectId":"isabah-person-al-aswad-ibn-nawfal-v1","supersededByClaimId":null,"supersedesClaimIds":[],"transmissionStrength":"source_supported"},{"assertionClass":"attested","claimType":"event_participation","correctionOfClaimId":null,"evidentiaryStrength":"source_supported","factualAmbiguityCodes":[],"id":"isabah-claim-al-aswad-migration-two-v1","objectId":"isabah-event-al-aswad-migration-two-v1","predicate":"participated_in","rationaleCodes":["context-not-subject-biography"],"sourceCriticalStatus":"unqualified","sourceRecordIds":["openiti-5835c183-unit-000171"],"sourceReportExistence":"attested_in_source","status":"active","storyAttributionRequired":false,"storyUseTier":"qualified_context","subjectId":"isabah-person-al-aswad-ibn-nawfal-v1","supersededByClaimId":null,"supersedesClaimIds":[],"transmissionStrength":"source_supported"},{"assertionClass":"attested","claimType":"relationship","correctionOfClaimId":null,"evidentiaryStrength":"limited","factualAmbiguityCodes":["genealogical-identity"],"id":"isabah-claim-asad-nephew-of-khadijah-v1","objectId":"isabah-relationship-asad-nephew-of-khadijah-v1","predicate":"nephew_of","rationaleCodes":["competing-genealogical-attributions","transmission-chain-criticism"],"sourceCriticalStatus":"disputed","sourceRecordIds":["openiti-5835c183-unit-000097"],"sourceReportExistence":"attested_in_source","status":"active","storyAttributionRequired":true,"storyUseTier":"attributed_disputed_report","subjectId":"isabah-person-asad-ibn-khuwaylid-v1","supersededByClaimId":null,"supersedesClaimIds":[],"transmissionStrength":"criticized"},{"assertionClass":"attested","claimType":"relationship","correctionOfClaimId":null,"evidentiaryStrength":"limited","factualAmbiguityCodes":["genealogical-identity"],"id":"isabah-claim-asad-son-of-nawfal-v1","objectId":"isabah-relationship-asad-son-of-nawfal-v1","predicate":"son_of","rationaleCodes":["possible-lineage-reconciliation"],"sourceCriticalStatus":"qualified","sourceRecordIds":["openiti-5835c183-unit-000097"],"sourceReportExistence":"attested_in_source","status":"active","storyAttributionRequired":true,"storyUseTier":"attributed_disputed_report","subjectId":"isabah-person-asad-ibn-khuwaylid-v1","supersededByClaimId":null,"supersedesClaimIds":[],"transmissionStrength":"not_assessed"},{"assertionClass":"attested","claimType":"relationship","correctionOfClaimId":null,"evidentiaryStrength":"source_supported","factualAmbiguityCodes":["genealogical-identity"],"id":"isabah-claim-nawfal-brother-of-khadijah-v1","objectId":"isabah-relationship-nawfal-brother-of-khadijah-v1","predicate":"brother_of","rationaleCodes":["genealogists-source-context"],"sourceCriticalStatus":"unqualified","sourceRecordIds":["openiti-5835c183-unit-000097"],"sourceReportExistence":"attested_in_source","status":"active","storyAttributionRequired":true,"storyUseTier":"qualified_context","subjectId":"isabah-person-nawfal-ibn-khuwaylid-v1","supersededByClaimId":null,"supersedesClaimIds":[],"transmissionStrength":"not_assessed"},{"assertionClass":"attested","claimType":"relationship","correctionOfClaimId":null,"evidentiaryStrength":"not_established","factualAmbiguityCodes":["maternal-attribution"],"id":"isabah-claim-khadijah-mother-of-ibrahim-v1","objectId":"isabah-relationship-khadijah-mother-of-ibrahim-v1","predicate":"mother_of","rationaleCodes":["missing-corroboration","source-author-rejection"],"sourceCriticalStatus":"rejected","sourceRecordIds":["openiti-5835c183-unit-000399"],"sourceReportExistence":"attested_in_source","status":"active","storyAttributionRequired":true,"storyUseTier":"attributed_disputed_report","subjectId":"isabah-person-khadijah-bint-khuwaylid-v1","supersededByClaimId":null,"supersedesClaimIds":[],"transmissionStrength":"not_assessed"},{"assertionClass":"attested","claimType":"relationship","correctionOfClaimId":null,"evidentiaryStrength":"source_supported","factualAmbiguityCodes":["maternal-attribution"],"id":"isabah-claim-mariya-mother-of-ibrahim-v1","objectId":"isabah-relationship-mariya-mother-of-ibrahim-v1","predicate":"mother_of","rationaleCodes":["competing-maternal-attribution"],"sourceCriticalStatus":"unqualified","sourceRecordIds":["openiti-5835c183-unit-000399"],"sourceReportExistence":"attested_in_source","status":"active","storyAttributionRequired":true,"storyUseTier":"qualified_context","subjectId":"isabah-person-mariya-v1","supersededByClaimId":null,"supersedesClaimIds":[],"transmissionStrength":"not_assessed"},{"assertionClass":"attested","claimType":"event_participation","correctionOfClaimId":null,"evidentiaryStrength":"limited","factualAmbiguityCodes":["journey-context","identity-and-chronology"],"id":"isabah-claim-abu-talib-commercial-journey-v1","objectId":"isabah-event-abu-talib-commercial-journey-v1","predicate":"participated_in","rationaleCodes":["competing-journey-contexts","transmission-and-interpolation-qualification"],"sourceCriticalStatus":"qualified","sourceRecordIds":["openiti-5835c183-unit-000795"],"sourceReportExistence":"attested_in_source","status":"active","storyAttributionRequired":true,"storyUseTier":"attributed_disputed_report","subjectId":"isabah-person-muhammad-ibn-abd-allah-v1","supersededByClaimId":null,"supersedesClaimIds":[],"transmissionStrength":"mixed"},{"assertionClass":"attested","claimType":"event_participation","correctionOfClaimId":null,"evidentiaryStrength":"limited","factualAmbiguityCodes":["journey-context","identity-and-chronology"],"id":"isabah-claim-khadijah-commercial-journey-v1","objectId":"isabah-event-khadijah-commercial-journey-v1","predicate":"participated_in","rationaleCodes":["competing-journey-contexts","identity-and-chronology-qualification"],"sourceCriticalStatus":"qualified","sourceRecordIds":["openiti-5835c183-unit-000795"],"sourceReportExistence":"attested_in_source","status":"active","storyAttributionRequired":true,"storyUseTier":"attributed_disputed_report","subjectId":"isabah-person-khadijah-bint-khuwaylid-v1","supersededByClaimId":null,"supersedesClaimIds":[],"transmissionStrength":"not_assessed"}],"inferred":[]},"contract":{"schemaId":"al-isabah.elixr-approved-story-projection.v1","schemaSha256":"0799db88413aee63c3e64115b020cf30105a184dee3c4c50d6fdb5f5b4735c1c","schemaVersion":"1.0.0"},"events":[{"id":"isabah-event-al-aswad-migration-one-v1","participantRoles":[{"personId":"isabah-person-al-aswad-ibn-nawfal-v1","role":"migrant"}],"sourceRecordIds":["openiti-5835c183-unit-000171"],"temporalStatus":"relative_only","type":"migration"},{"id":"isabah-event-al-aswad-migration-two-v1","participantRoles":[{"personId":"isabah-person-al-aswad-ibn-nawfal-v1","role":"migrant"}],"sourceRecordIds":["openiti-5835c183-unit-000171"],"temporalStatus":"relative_only","type":"migration"},{"id":"isabah-event-abu-talib-commercial-journey-v1","participantRoles":[{"personId":"isabah-person-abu-talib-v1","role":"caravan_leader"},{"personId":"isabah-person-muhammad-ibn-abd-allah-v1","role":"traveler"},{"personId":"isabah-person-bahira-jirjis-v1","role":"encountered_person"}],"sourceRecordIds":["openiti-5835c183-unit-000795"],"temporalStatus":"unstated","type":"commercial_journey"},{"id":"isabah-event-khadijah-commercial-journey-v1","participantRoles":[{"personId":"isabah-person-khadijah-bint-khuwaylid-v1","role":"commissioning_principal"},{"personId":"isabah-person-muhammad-ibn-abd-allah-v1","role":"traveler"},{"personId":"isabah-person-maysara-v1","role":"companion"},{"personId":"isabah-person-bahira-jirjis-v1","role":"encountered_person"}],"sour